A1: SECCION | B1: MATERIALES | C1: CANTIDAD | D1: PRECIO UNITARIO | E1: PRECIO TOTAL
A2: ELECTRICIDAD | B2: PINZA | C2: 1 | D2: 9 | E2: =C2*D2 -> 9
B3: CINTA AISLADORA | C3: 1 | D3: 2.5 | E3: =C3*D3 -> 2.5
B4: CABLE UNIPOLAR 1m | C4: 1 | D4: 2.4 | E4: =C4*D4 -> 2.4
B5: CABLE BIPOLAR 1m | C5: 1 | D5: 1.25 | E5: =C5*D5 -> 1.25
A6: ELECTRONICA | B6: PLAQUETA PERFORADA 5X5 | C6: 1 | D6: 2.5 | E6: =D6*C6 -> 2.5
B7: TRIAC BTB 08-600 | C7: 2 | D7: 1 | E7: =D7*C7 -> 2
B8: DIAC | C8: 1 | D8: 0.75 | E8: =D8*C8 -> 0.75
B9: CAPACITORES 100 NANO FARADIOS X 400 volt | C9: 2 | D9: 2 | E9: =D9*C9 -> 4
B10: RESISTENCIA 8,2k | C10: 2 | D10: 0.65 | E10: =D10*C10 -> 1.3
B11: POTENCIOMETRO 250k | C11: 1 | D11: 1.5 | E11: =D11*C11 -> 1.5
B12: GABINETE PLASTICO 2X3X5 cm (GABY-MINY) | C12: 1 | D12: 7 | E12: =D12*C12 -> 7
B13: FICHA MACHO | C13: 1 | D13: 0.85 | E13: =D13*C13 -> 0.85
B14: FICHA HEMBRA | C14: 1 | D14: 0.85 | E14: =D14*C14 -> 0.85
B15: 1,54 DE CABLE BIPOLAR 1mm | C15: 1 | D15: 2.2 | E15: =D15*C15 -> 2.2
A16: AJUSTE | B16: MATERIALES PARA EL TRABAJO | C16: 1 | D16: 15 | E16: =C16*D16 -> 15
B17: LIMA PLANA 10º | C17: 1 | D17: 15 | E17: =C17*D17 -> 15
B18: HOJA DE 18 DIENTES | C18: 2 | D18: 5 | E18: =C18*D18 -> 10
A19: SOLDADURA | B19: MATERIALES PARA EL TRABAJO | C19: 1 | D19: 56 | E19: =C19*D19 -> 56
A20: TOTAL | E20: =SUM(E2:E19) -> 134.1